name	doi	citation	img_path	research_snippet
rgbif	10.1093/icesjms/fsz207	D’Amen, M., & Azzurro, E. (2019). Lessepsian fish invasion in Mediterranean marine protected areas: a risk assessment under climate change scenarios. ICES Journal of Marine Science, 77(1), 388–397. <https://doi.org/10.1093/icesjms/fsz207>	NA	fish and climate change
CoordinateCleaner	10.1111/ddi.13004	Zizka, A., Azevedo, J., Leme, E., Neves, B., Costa, A. F., Caceres, D., & Zizka, G. (2019). Biogeography and conservation status of the pineapple family (Bromeliaceae). Diversity and Distributions, 26(2), 183–195. <https://doi.org/10.1111/ddi.13004>	img/ZizkaEtal2019Diversity&Distributions.png	biogeography of the pineapple family
taxize	NA	Knoploch, C., C. Grinand, G. Vieilledent. 2019. The importance of deforestation and climate change in shaping lemurs’ distributions and identifying their areas of climatic refuges. Thesis. <https://www.nitidae.org/files/46082c83/the_importance_of_deforestation_and_climate_change_in_shaping_lemurs_distributions_and_identifying_their_areas_of_climatic_refuges.pdf>	NA	lemurs, deforestation and climate change
CoordinateCleaner	NA	Knoploch, C., C. Grinand, G. Vieilledent. 2019. The importance of deforestation and climate change in shaping lemurs’ distributions and identifying their areas of climatic refuges. Thesis. <https://www.nitidae.org/files/46082c83/the_importance_of_deforestation_and_climate_change_in_shaping_lemurs_distributions_and_identifying_their_areas_of_climatic_refuges.pdf>	NA	lemurs, deforestation and climate change
MODIStsp	10.1007/s10661-019-7934-x	Badreldin, N., Abu Hatab, A., & Lagerkvist, C.-J. (2019). Spatiotemporal dynamics of urbanization and cropland in the Nile Delta of Egypt using machine learning and satellite big data: implications for sustainable development. Environmental Monitoring and Assessment, 191(12). <https://doi.org/10.1007/s10661-019-7934-x>	NA	urbanization in the Nile Delta
tacmagic	NA	Brown, E.E. 2019. Alzheimer’s Disease Pathophysiology and Risk Factors with Amyloid Positron Emission Tomography, an Open Science Approach, and the Consideration of Environmental Exposures. Master's Thesis. <https://tspace.library.utoronto.ca/bitstream/1807/97859/1/Brown_Eric_E_201911_MSc_thesis.pdf>	NA	Alzheimer’s Disease
hunspell	10.2196/14285	Booth, A., Bell, T., Halhol, S., Pan, S., Welch, V., Merinopoulou, E., … Cox, A. (2019). Using Social Media to Uncover Treatment Experiences and Decisions in Patients With Acute Myeloid Leukemia or Myelodysplastic Syndrome Who Are Ineligible for Intensive Chemotherapy: Patient-Centric Qualitative Data Analysis. Journal of Medical Internet Research, 21(11), e14285. <https://doi.org.10.2196/14285>	NA	using social media to research treatment experiences
rnaturalearth	NA	Næss, M. W. (2019). From hunter-gatherers to nomadic pastoralists: forager bands do not tell the whole story of the evolution of human cooperation. <https://doi.org/10.31235/osf.io/9c8bm>	NA	evolution of human cooperation
UCSCXenaTools	10.7554/eLife.49020	Wang, S., He, Z., Wang, X., Li, H., & Liu, X.-S. (2019). Antigen presentation and tumor immunogenicity in cancer immunotherapy response prediction. eLife, 8. <https://doi.org/10.7554/elife.49020>	NA	cancer research
rfishbase	10.1111/faf.12427	Thorson, J. T. (2019). Predicting recruitment density dependence and intrinsic growth rate for all fishes worldwide using a data‐integrated life‐history model. Fish and Fisheries. <https://doi.org/10.1111/faf.12427	NA	recruitement and growth rate in fishes
taxize	10.1111/1365-2656.13153	Geary, W. L., Doherty, T. S., Nimmo, D. G., Tulloch, A. I. T., & Ritchie, E. G. (2020). Predator responses to fire: A global systematic review and meta‐analysis. Journal of Animal Ecology. <https://doi.org/10.1111/1365-2656.13153>	img/GearyEtal2019JournalOfAnimalEcology.png	predator responses to fire
FedData	10.1145/3363459.3363536	Hong, T., Xu, Y., Sun, K., Zhang, W., & Luo, X. (2019). Visualizing Urban Microclimate and Quantifying its Impact on Building Energy Use in San Francisco. Proceedings of the 1st ACM International Workshop on Urban Building Energy Sensing, Controls, Big Data Analysis, and Visualization  - UrbSys’19. <https://doi.org/10.1145/3363459.3363536>	NA	urban microclimate and building energy use
biomartR	10.1038/s41467-019-11807-4	Lange, H., Ndecky, S. Y. A., Gomez-Diaz, C., Pflieger, D., Butel, N., Zumsteg, J., … Gagliardi, D. (2019). RST1 and RIPR connect the cytosolic RNA exosome to the Ski complex in Arabidopsis. Nature Communications, 10(1). <https://doi.org/10.1038/s41467-019-11807-4>	NA	RNA and Arabidopsis
spocc	10.1002/ece3.5884	Báez, J. C., Barbosa, A. M., Pascual, P., Ramos, M. L., & Abascal, F. (2019). Ensemble modeling of the potential distribution of the whale shark in the Atlantic Ocean. Ecology and Evolution, 10(1), 175–184. <https://doi.org/10.1002/ece3.5884>	img/BaezEtal2019Ecology&Evolutino.png	whale shark distribution
MODIStsp	10.1038/s41597-019-0314-0	Estrada-Peña, A., Nava, S., Tarragona, E., Bermúdez, S., de la Fuente, J., Domingos, A., … Guglielmone, A. A. (2019). Species occurrence of ticks in South America, and interactions with biotic and abiotic traits. Scientific Data, 6(1). <https://doi.org/10.1038/s41597-019-0314-0>	NA	ticks in South America
rotl	10.1038/s41597-019-0314-0	Estrada-Peña, A., Nava, S., Tarragona, E., Bermúdez, S., de la Fuente, J., Domingos, A., … Guglielmone, A. A. (2019). Species occurrence of ticks in South America, and interactions with biotic and abiotic traits. Scientific Data, 6(1). <https://doi.org/10.1038/s41597-019-0314-0>	NA	ticks in South America
rfishbase	10.1038/s41597-019-0307-z	Lecocq, T., Benard, A., Pasquet, A., Nahon, S., Ducret, A., Dupont-Marin, K., … Thomas, M. (2019). TOFF, a database of traits of fish to promote advances in fish aquaculture. Scientific Data, 6(1). <https://doi.org/10.1038/s41597-019-0307-z>	NA	a database of fish traits
rgbif	NA	Reis, V. S. (2019). Uma perspectiva macroecológica sobre o risco de extinção em mamíferos. Thesis. <http://bit.ly/38mfmHG>	NA	description
camsRad	10.1016/j.apenergy.2019.114122	Yagli, G. M., Yang, D., Gandhi, O., & Srinivasan, D. (2019). Can we justify producing univariate machine-learning forecasts with satellite-derived solar irradiance? Applied Energy, 114122. <https://doi.org/10.1016/j.apenergy.2019.114122>	NA	machine learning forecasts
UCSCXenaTools	10.1186/s13072-019-0316-3OIz	Li, Y., Ge, D., & Lu, C. (2019). The SMART App: an interactive web application for comprehensive DNA methylation analysis and visualization. Epigenetics & Chromatin, 12(1). <https://doi.org/10.1186/s13072-019-0316-3>	NA	a web app for DNA methylation analysis
rcrossref	10.7554/elife.52646	Fu, D. Y., & Hughey, J. J. (2019). Releasing a preprint is associated with more attention and citations for the peer-reviewed article. eLife, 8. <https://doi.org/10.7554/elife.52646>	NA	attention and citations in preprints
rentrez	10.7554/elife.52646	Fu, D. Y., & Hughey, J. J. (2019). Releasing a preprint is associated with more attention and citations for the peer-reviewed article. eLife, 8. <https://doi.org/10.7554/elife.52646>	NA	attention and citations in preprints
rAltmetric	10.7554/elife.52646	Fu, D. Y., & Hughey, J. J. (2019). Releasing a preprint is associated with more attention and citations for the peer-reviewed article. eLife, 8. <https://doi.org/10.7554/elife.52646>	NA	attention and citations in preprints
rotl	10.1111/nph.16361	Godfrey, J. M., Riggio, J., Orozco, J., Guzmán‐Delgado, P., Chin, A. R. O., & Zwieniecki, M. A. (2020). Ray fractions and carbohydrate dynamics of tree species along a 2750 m elevation gradient indicate climate response, not spatial storage limitation. New Phytologist, 225(6), 2314–2330. <https://doi.org/10.1111/nph.16361>	NA	responses of tree species to an elevation gradient
rnoaa	NA	Zhong, B. (2019). Towards Developing a Double Cropping System Between Winter Barley and Soybean in the Upper Midwest. <https://conservancy.umn.edu/bitstream/handle/11299/208973/Zhong_umn_0130M_20797.pdf?sequence=1&isAllowed=y>	NA	developing a double cropping system with barley and soybean
NLMR	10.1126/science.aax9387	Betts, M. G., Wolf, C., Pfeifer, M., Banks-Leite, C., Arroyo-Rodríguez, V., Ribeiro, D. B., … Ewers, R. M. (2019). Extinction filters mediate the global effects of habitat fragmentation on animals. Science, 366(6470), 1236–1239. <https://doi.org/10.1126/science.aax9387>	img/BettsEtal2019Science.png	habitat fragmentation
landscapetools	10.1126/science.aax9387	Betts, M. G., Wolf, C., Pfeifer, M., Banks-Leite, C., Arroyo-Rodríguez, V., Ribeiro, D. B., … Ewers, R. M. (2019). Extinction filters mediate the global effects of habitat fragmentation on animals. Science, 366(6470), 1236–1239. <https://doi.org/10.1126/science.aax9387>	img/BettsEtal2019Science.png	habitat fragmentation
iheatmapr	10.1111/pedi.12952	Kim, K. W., Allen, D. W., Briese, T., Couper, J. J., Barry, S. C., … Colman, P. G. (2020). Higher frequency of vertebrate‐infecting viruses in the gut of infants born to mothers with type 1 diabetes. Pediatric Diabetes, 21(2), 271–279. <https://doi.org/10.1111/pedi.12952>	NA	type 1 diabetes and infant viruses
clifro	10.3354/aei00337	Atalah, J., & Forrest, B. (2019). Forecasting mussel settlement using historical data and boosted regression trees. Aquaculture Environment Interactions, 11, 625–638. <https://doi.org/10.3354/aei00337>	NA	mussel settlement using historical data
biomartr	10.7717/peerj.8192	Karakülah, G., Arslan, N., Yandım, C., & Suner, A. (2019). TEffectR: an R package for studying the potential effects of transposable elements on gene expression with linear regression model. PeerJ, 7, e8192. <https://doi.org/10.7717/peerj.8192>	NA	an R package for studying gene expression
rgbif	10.1088/1755-1315/363/1/012025	Yusri, S., Siregar, V. P., & Suharsono. (2019). Distribution Modelling of Porites (Poritidae) in Indonesia. IOP Conference Series: Earth and Environmental Science, 363, 012025. <https://doi.org/10.1088/1755-1315/363/1/012025>	NA	distribution modelling of a coral in Indonesia
rotl	10.1038/s41559-019-1052-6	Clark, T. J., & Luis, A. D. (2019). Nonlinear population dynamics are ubiquitous in animals. Nature Ecology & Evolution, 4(1), 75–81. <https://doi.org/10.1038/s41559-019-1052-6>	NA	nonlinear population dynamics
rgbif	10.1016/j.biocon.2019.108255	Ekroos, J., Kleijn, D., Batáry, P., Albrecht, M., Báldi, A., Blüthgen, N., … Smith, H. G. (2020). High land-use intensity in grasslands constrains wild bee species richness in Europe. Biological Conservation, 241, 108255. <https://doi.org/10.1016/j.biocon.2019.108255>	NA	bee conservation in Europe
visdat	NA	Lysne, V. (2019). Biomarkers of one-carbon metabolism and B-vitamin status: Targeted metabolomics in rats and humans exploring the effects of PPARα-activation and dietary composition. <http://bora.uib.no/bitstream/handle/1956/21069/Dt.thesis_2019_Vegard_Lysne.pdf?sequence=1&isAllowed=y>	NA	targeted metabolomics in rats and humans
rentrez	10.1002/mgg3.1085	Vitale, O., Preste, R., Palmisano, D., & Attimonelli, M. (2019). A data and text mining pipeline to annotate human mitochondrial variants with functional and clinical information. Molecular Genetics & Genomic Medicine, 8(2). <https://doi.org/10.1002/mgg3.1085>	NA	annotating human mitochondrial variants
fulltext	10.1002/mgg3.1085	Vitale, O., Preste, R., Palmisano, D., & Attimonelli, M. (2019). A data and text mining pipeline to annotate human mitochondrial variants with functional and clinical information. Molecular Genetics & Genomic Medicine, 8(2). <https://doi.org/10.1002/mgg3.1085>	NA	annotating human mitochondrial variants
rentrez	10.21203/rs.2.16269/v3	Wcisel, D. J., III, J. T. H., Yoder, J. A., & Dornburg, A. (preprint) Transcriptome Ortholog Alignment Sequence Tools (TOAST) for Phylogenomic Dataset Assembly. <https://doi.org/10.21203/rs.2.16269/v3> 	NA	tools for phylogeonomic dataset assembly
rtweet	10.1016/j.esxm.2019.07.001	Sansone, A., Cignarelli, A., Ciocca, G., Pozza, C., Giorgino, F., Romanelli, F., & Jannini, E. A. (2019). The Sentiment Analysis of Tweets as a New Tool to Measure Public Perception of Male Erectile and Ejaculatory Dysfunctions. Sexual Medicine, 7(4), 464–471. <https://doi.org/10.1016/j.esxm.2019.07.001>	NA	tweet senitment analysis
rdhs	10.9745/ghsp-d-19-00205	Finnegan, A., Sao, S. S., & Huchko, M. J. (2019). Using a Chord Diagram to Visualize Dynamics in Contraceptive Use: Bringing Data Into Practice. Global Health: Science and Practice, 7(4), 598–605. <https://doi.org/10.9745/ghsp-d-19-00205>	NA	data and contraceptive use
chlorpromazineR	10.1016/j.pnpbp.2019.109839	Kim, J., Plitman, E., Iwata, Y., Nakajima, S., Mar, W., Patel, R., … Graff-Guerrero, A. (2020). Neuroanatomical profiles of treatment-resistance in patients with schizophrenia spectrum disorders. Progress in Neuro-Psychopharmacology and Biological Psychiatry, 99, 109839. <https://doi.org/10.1016/j.pnpbp.2019.109839>	NA	schizophrenia spectrum disorders
assertr	NA	van der Loo, M. P., & de Jonge, E. (2019). Data Validation Infrastructure for R. arXiv preprint arXiv:1912.09759. <https://arxiv.org/pdf/1912.09759.pdf>	NA	data validation
rgbif	10.7717/peerj.8059	Marshall, B. M., & Strine, C. T. (2019). Exploring snake occurrence records: Spatial biases and marginal gains from accessible social media. PeerJ, 7, e8059. <https://doi.org/10.7717/peerj.8059>	img/Marshall&Strine2019PeerJ.png	social media and snake occurrence records
taxize	10.7717/peerj.8059	Marshall, B. M., & Strine, C. T. (2019). Exploring snake occurrence records: Spatial biases and marginal gains from accessible social media. PeerJ, 7, e8059. <https://doi.org/10.7717/peerj.8059>	img/Marshall&Strine2019PeerJ.png	social media and snake occurrence records
CoordinateCleaner	10.7717/peerj.8059	Marshall, B. M., & Strine, C. T. (2019). Exploring snake occurrence records: Spatial biases and marginal gains from accessible social media. PeerJ, 7, e8059. <https://doi.org/10.7717/peerj.8059>	img/Marshall&Strine2019PeerJ.png	social media and snake occurrence records
rnaturalearth	10.7717/peerj.8059	Marshall, B. M., & Strine, C. T. (2019). Exploring snake occurrence records: Spatial biases and marginal gains from accessible social media. PeerJ, 7, e8059. <https://doi.org/10.7717/peerj.8059>	img/Marshall&Strine2019PeerJ.png	social media and snake occurrence records
weathercan	NA	Cameron, J. (2019). Improving passive acoustic monitoring methods for anuran amphibians in northern Alberta, Canada. <https://era.library.ualberta.ca/items/82cf4970-7243-49cc-88ac-cbef893cd062>	NA	acoustic monitoring methods for amphibians
taxize	NA	Pontes, L. F. V. A. (2019). Biodiversity informatics-entomological data processing, analysis and visualization (Doctoral dissertation) <https://repositorio.ul.pt/bitstream/10451/40544/1/ulfc125176_tm_Leonor_Pontes.pdf>	NA	entomological data processing and analysis
rtweet	10.22323/2.18060205	Tancoigne, E. (2019). Invisible brokers: “citizen science” on Twitter. Journal of Science Communication, 18(06). <https://doi.org/10.22323/2.18060205>	NA	citizen science on Twitter
bikedata	10.32866/10802	Hosford, K., & Winters, M. 2019. Quantifying the Bicycle Share Gender Gap. Transport Findings, November. <https://doi.org/10.32866/10802>	NA	bicycle share gender gap
biomartr	10.1128/mSystems.00579-19	Noecker, C., Chiu, H. C., McNally, C. P., & Borenstein, E. (2019). Defining and evaluating microbial contributions to metabolite variation in microbiome-metabolome association studies. mSystems, 4(6). <https://doi.org/10.1128/mSystems.00579-19>	NA	microbial contributions to metabolite variation
restez	10.17129/botsci.2226	Ruiz-Sanchez, E., Maya-Lastra, C. A., Steinmann, V. W., Zamudio, S., Carranza, E., Murillo, R. M., & Rzedowski, J. (2019). Datataxa: a new script to extract metadata sequence information from GenBank, the Flora of Bajío as a case study. Botanical Sciences, 97(4), 754–760. <https://doi.org/10.17129/botsci.2226>	NA	code to extract data from GenBank
phylotaR	10.17129/botsci.2226	Ruiz-Sanchez, E., Maya-Lastra, C. A., Steinmann, V. W., Zamudio, S., Carranza, E., Murillo, R. M., & Rzedowski, J. (2019). Datataxa: a new script to extract metadata sequence information from GenBank, the Flora of Bajío as a case study. Botanical Sciences, 97(4), 754–760. <https://doi.org/10.17129/botsci.2226>	NA	code to extract data from GenBank
rtweet	10.1080/15348423.2019.1696121	Greenhalgh, S. P., Willet, K. B. S., & Koehler, M. J. (2019). Approaches to Mormon Identity and Practice in the #ldsconf Twitter Hashtag. Journal of Media and Religion, 18(4), 122–133. <https://doi.org/10.1080/15348423.2019.1696121>	NA	religion in tweets
rentrez	10.1101/436659	Die, J. V., Elmassry, M. M., LeBlanc, K. H., Awe, O. I., Dillman, A., & Busby, B. (2018). GeneHummus: A pipeline to define gene families and their expression in legumes and beyond. <https://doi.org/10.1101/436659>	NA	a pipeline for defining gene families
magick	10.1101/427658	Maia, R., Gruson, H., Endler, J. A., & White, T. E. (2018). pavo 2: new tools for the spectral and spatial analysis of colour in R. <https://doi.org/10.1101/427658>	NA	tools for colour analysis
magick	NA	Mowinckel, A. M., & Vidal-Piñeiro, D. (2019). Visualisation of Brain Statistics with R-packages ggseg and ggseg3d. arXiv preprint arXiv:1912.08200 <https://arxiv.org/abs/1912.08200>	NA	visualization of brain statistics
taxize	10.1007/s10886-019-01130-z	Champagne, E., Royo, A. A., Tremblay, J.-P., & Raymond, P. (2019). Phytochemicals Involved in Plant Resistance to Leporids and Cervids: a Systematic Review. Journal of Chemical Ecology, 46(1), 84–98. <https://doi.org/10.1007/s10886-019-01130-z>	NA	review of plant resistance phytochemicals
taxize	10.1111/gcb.14968	Burrows, M. T., Hawkins, S. J., Moore, J. J., Adams, L., Sugden, H., Firth, L., & Mieszkowska, N. (2020). Global‐scale species distributions predict temperature‐related changes in species composition of rocky shore communities in Britain. Global Change Biology, 26(4), 2093–2105. <https://doi.org/10.1111/gcb.14968>	NA	temperature related changes in species composition
lingtypology	NA	Avdeev, S. (2019). International Collaboration In Higher Education Research: A Gravity Model Approach. Higher School of Economics Research Paper No. WP BRP, 54. <https://wp.hse.ru/data/2019/12/18/1523102390/54EDU2019.pdf>	NA	education research
brranching	10.1002/ecm.1402	Herrera, C. M. (2020). Flower traits, habitat, and phylogeny as predictors of pollinator service: a plant community perspective. Ecological Monographs. <https://doi.org/10.1002/ecm.1402>	NA	pollination from a community perspective
taxize	10.4490/algae.2019.34.12.10	Kim, H. M., Jo, J., Park, C., Choi, B.-J., Lee, H.-G., & Kim, K. Y. (2019). Epibionts associated with floating Sargassum horneri in the Korea Strait. ALGAE, 34(4), 303–313. <https://doi.org/10.4490/algae.2019.34.12.10>	NA	epibionts associated with floating seaweed
osmdata	NA	Hsu, C. W. (2019). Disparities in public charging infrastructure deployment and inequitable electric vehicle ownership cost based on income and race (Doctoral dissertation, Humboldt State University). <http://bit.ly/2MQDAAF>	NA	disparities in public charging infrastructure
MODIStsp	10.1016/j.rsase.2019.100281	Fatikhunnada, A., Liyantono, Solahudin, M., Buono, A., Kato, T., & Seminar, K. B. (2020). Assessment of pre-treatment and classification methods for Java paddy field cropping pattern detection on MODIS images. Remote Sensing Applications: Society and Environment, 17, 100281. <https://doi.org/10.1016/j.rsase.2019.100281>	NA	MODIS images and cropping pattern detection
taxize	10.1002/ece3.5921	Hansen, O. L. P., Svenning, J., Olsen, K., Dupont, S., Garner, B. H., Iosifidis, A., … Høye, T. T. (2019). Species‐level image classification with convolutional neural network enables insect identification from habitus images. Ecology and Evolution, 10(2), 737–747. <https://doi.org/10.1002/ece3.5921>	img/HansenEtal2019Ecology&Evolution.png	insect identification using images
skimr	NA	Kovalenko, Y. (2019). Stop and smell the grapes : altering cultivar-typical aromas in Gewürztraminer (Vitis vinifera L.) berries via regulated deficit irrigation and crop load management (T). University of British Columbia. <https://open.library.ubc.ca/cIRcle/collections/ubctheses/24/items/1.0387322>	NA	wine grape research
rgbif	10.1111/jbi.13789	Mienna, I. M., Speed, J. D. M., Bendiksby, M., Thornhill, A. H., Mishler, B. D., & Martin, M. D. (2019). Differential patterns of floristic phylogenetic diversity across a post‐glacial landscape. Journal of Biogeography. <https://doi.org/10.1111/jbi.13789>	img/MiennaEtal2019JournalOfBiogeography.png	phylogenetic diversity in a post-glacial landscape
CoordinateCleaner	10.1016/j.palaeo.2019.109523	Asevedo, L., D’Apolito, C., Misumi, S. Y., Barros, M. A. de, Barth, O. M., & Avilla, L. dos S. (2020). Palynological analysis of dental calculus from Pleistocene proboscideans of southern Brazil: A new approach for paleodiet and paleoenvironmental reconstructions. Palaeogeography, Palaeoclimatology, Palaeoecology, 540, 109523. <https://doi.org/10.1016/j.palaeo.2019.109523>	NA	palynological analysis of fossil teeth in an extinct mastodon
riem	10.1016/j.scitotenv.2019.136114	Milà, C., Curto, A., Dimitrova, A., Sreekanth, V., Kinra, S., Marshall, J. D., & Tonne, C. (2020). Identifying predictors of personal exposure to air temperature in peri-urban India. Science of The Total Environment, 707, 136114. <https://doi.org/10.1016/j.scitotenv.2019.136114>	NA	personal air temperature
rtimicropem	10.1016/j.scitotenv.2019.136114	Milà, C., Curto, A., Dimitrova, A., Sreekanth, V., Kinra, S., Marshall, J. D., & Tonne, C. (2020). Identifying predictors of personal exposure to air temperature in peri-urban India. Science of The Total Environment, 707, 136114. <https://doi.org/10.1016/j.scitotenv.2019.136114>	NA	personal air temperature
MODISTools	10.1016/j.envsoft.2019.104606	Nguyen, V. T., Dietrich, J., & Uniyal, B. (2020). Modeling interbasin groundwater flow in karst areas: Model development, application, and calibration strategy. Environmental Modelling & Software, 124, 104606. <https://doi.org/10.1016/j.envsoft.2019.104606>	img/NguyenEtal2020EnvironmentalModelling&Software.png	modeling groundwater flow
MODISTools	10.1016/j.jmarsys.2019.103282	Torregroza-Espinosa, A. C., Restrepo, J. C., Correa-Metrio, A., Hoyos, N., Escobar, J., Pierini, J., & Martínez, J.-M. (2020). Fluvial and oceanographic influences on suspended sediment dispersal in the Magdalena River Estuary. Journal of Marine Systems, 204, 103282. <https://doi.org/10.1016/j.jmarsys.2019.103282>	NA	suspended sediment
MODIStsp	10.1016/j.scitotenv.2019.136165	Akpoti, K., Kabo-bah, A. T., Dossou-Yovo, E. R., Groen, T. A., & Zwart, S. J. (2020). Mapping suitability for rice production in inland valley landscapes in Benin and Togo using environmental niche modeling. Science of The Total Environment, 709, 136165. <https://doi.org/10.1016/j.scitotenv.2019.136165>	NA	mapping suitable rice production land
rtweet	10.1016/j.jbusres.2019.11.071	Mingione, M., Cristofaro, M., & Mondi, D. (2020). If I give you my emotion, what do I get? Conceptualizing and measuring the co-created emotional value of the brand. Journal of Business Research, 109, 310–320. <https://doi.org/10.1016/j.jbusres.2019.11.071>	NA	emotional brand value
rgbif	10.1111/jbi.13761	D’Amen, M., & Azzurro, E. (2019). Integrating univariate niche dynamics in species distribution models: A step forward for marine research on biological invasions. Journal of Biogeography, 47(3), 686–697. <https://doi.org/10.1111/jbi.13761>	NA	niche dynamics in species distribution models
iheatmapr	10.1186/s12953-019-0156-x	Meng, S., Zhan, S., Dou, W., & Ge, W. (2019). The interactome and proteomic responses of ALKBH7 in cell lines by in-depth proteomics analysis. Proteome Science, 17(1). <https://doi.org/10.1186/s12953-019-0156-x>	NA	proteomic analysis
rnaturalearth	10.3390/su12010394	Czernecki, B., Głogowski, A., & Nowosad, J. (2020). Climate: An R Package to Access Free In-Situ Meteorological and Hydrological Datasets For Environmental Assessment. Sustainability, 12(1), 394. <https://doi.org/10.3390/su12010394>	NA	an R package for climate data
iheatmapr	10.1038/s41423-019-0346-6	Shi, L., Tian, H., Wang, P., Li, L., Zhang, Z., Zhang, J., & Zhao, Y. (2020). Spaceflight and simulated microgravity suppresses macrophage development via altered RAS/ERK/NFκB and metabolic pathways. Cellular & Molecular Immunology. <https://doi.org/10.1038/s41423-019-0346-6>	NA	microgravity and macrophage development
pdftools	NA	Lestina, F. Trends in US Foreign Policy Prioritizations, 2000–2019. Proceedings of the 53rd Hawaii International Conference on System Sciences.  <https://scholarspace.manoa.hawaii.edu/bitstream/10125/63832/0074.pdf>	NA	United States foreign policy prioritization
taxize	10.1111/1365-2745.13352	Quintero, E., Pizo, M. A., & Jordano, P. (2020). Fruit resource provisioning for avian frugivores: The overlooked side of effectiveness in seed dispersal mutualisms. Journal of Ecology. <https://doi.org/10.1111/1365-2745.13352>	NA	fruit resource provisioning in avian frugivores
rfishbase	10.1111/1365-2664.13549	Blowes, S. A., Chase, J. M., Di Franco, A., Frid, O., Gotelli, N. J., Guidetti, P., … Belmaker, J. (2020). Mediterranean marine protected areas have higher biodiversity via increased evenness, not abundance. Journal of Applied Ecology, 57(3), 578–589. <https://doi.org/10.1111/1365-2664.13549>	NA	description
