name	doi	citation	img_path	research_snippet
hydroscoper	10.3390/w11051050	Vantas, K., Sidiropoulos, E., & Loukas, A. (2019). Robustness Spatiotemporal Clustering and Trend Detection of Rainfall Erosivity Density in Greece. Water, 11(5), 1050. <https://doi.org/10.3390/w11051050>	img/VantasEtal2019Water.png	rainfall erosivity in Greece 
rgbif	10.1111/geb.12923	Schubert, M., Marcussen, T., Meseguer, A. S., & Fjellheim, S. (2019). The grass subfamily Pooideae: Cretaceous–Palaeocene origin and climate‐driven Cenozoic diversification. Global Ecology and Biogeography. <https://doi.org/10.1111/geb.12923>	img/SchubertEtal2019GlobalEcology&Biogeography.png	origin and climate‐driven diversification in grasses
taxize	10.1038/s41586-019-1128-0	Steidinger, B. S., Crowther, T. W., Liang, J., Van Nuland, M. E., Werner, G. D. A., … Peay, K. G. (2019). Climatic controls of decomposition drive the global biogeography of forest-tree symbioses. Nature, 569(7756), 404–408. <https://doi.org/10.1038/s41586-019-1128-0>	img/SteidingerEtal2019Nature.png	decomposition and forest-tree symbioses
RSelenium	NA	Mitchell, J. M. (2019). Computational Tools for the Untargeted Assignment of FT-MS Metabolomics Datasets. Dissertation. <https://uknowledge.uky.edu/cgi/viewcontent.cgi?article=1042&context=biochem_etds>	NA	tools for metabolomics work
taxize	10.1016/j.ecolind.2019.04.088	Bagley, M., Pilgrim, E., Knapp, M., Yoder, C., Santo Domingo, J., & Banerji, A. (2019). High-throughput environmental DNA analysis informs a biological assessment of an urban stream. Ecological Indicators, 104, 378–389. <https://doi.org/10.1016/j.ecolind.2019.04.088>	NA	high-throughput environmental DNA and biological assessment
taxize	10.1111/1365-2745.13203	Foisy, M. R., Albert, L. P., Hughes, D. W. W., & Weber, M. G. (2019). Do latex and resin canals spur plant diversification? Re‐examining a classic example of escape and radiate coevolution. Journal of Ecology. <https://doi.org/10.1111/1365-2745.13203>	img/FoisyEtal2019JEcology.png	whether latex and resin canals spur plant diversification
plotly	10.1016/j.cmpb.2019.05.023	Ogłuszka, M., Orzechowska, M., Jędroszka, D., Witas, P., & Bednarek, A. K. (2019). Evaluate Cutpoints: Adaptable continuous data distribution system for determining survival in Kaplan-Meier estimator. Computer Methods and Programs in Biomedicine, 177, 133–139. <https://doi.org/10.1016/j.cmpb.2019.05.023>	NA	biomedical methods
rgbif	10.1016/j.algal.2019.101529	Westmeijer, G., Everaert, G., Pirlet, H., De Clerck, O., & Vandegehuchte, M. B. (2019). Mechanistic niche modelling to identify favorable growth sites of temperate macroalgae. Algal Research, 41, 101529. <https://doi.org/10.1016/j.algal.2019.101529>	img/WestmeijerEtal2019AlgalResearch.png	favorable growth sites for macroalgae
plotly	10.1098/rsbl.2019.0133	Kortz, A. R., & Magurran, A. E. (2019). Increases in local richness (α-diversity) following invasion are offset by biotic homogenization in a biodiversity hotspot. Biology Letters, 15(5), 20190133. <https://doi.org/10.1098/rsbl.2019.0133>	NA	biological diveristy in the Brazilian Cerrado
plotly	10.1093/nar/gkz411	Pérez-Palma, E., Gramm, M., Nürnberg, P., May, P., & Lal, D. (2019). Simple ClinVar: an interactive web server to explore and retrieve gene and disease variants aggregated in ClinVar database. Nucleic Acids Research. <https://doi.org/10.1093/nar/gkz411>	NA	a web tool for exploring genes
hunspell	10.12688/gatesopenres.12999.1	Green, E. P., Whitcomb, A., Kahumbura, C., Rosen, J. G., Goyal, S., Achieng, D., & Bellows, B. (2019). What is the best method of family planning for me?: a text mining analysis of messages between users and agents of a digital health service in Kenya. Gates Open Research, 3, 1475. <https://doi.org/10.12688/gatesopenres.12999.1>	NA	text mining digital health data
cld2	10.12688/gatesopenres.12999.1	Green, E. P., Whitcomb, A., Kahumbura, C., Rosen, J. G., Goyal, S., Achieng, D., & Bellows, B. (2019). What is the best method of family planning for me?: a text mining analysis of messages between users and agents of a digital health service in Kenya. Gates Open Research, 3, 1475. <https://doi.org/10.12688/gatesopenres.12999.1>	NA	text mining digital health data
rotl	10.1007/s00338-019-01820-w	Mihalitsis, M., & Bellwood, D. R. (2019). Morphological and functional diversity of piscivorous fishes on coral reefs. Coral Reefs. <https://doi.org/10.1007/s00338-019-01820-w>	img/Mihalitsis&Bellwood2019CoralReefs.png	diversity of piscivorous fishes on coral reefs
MODIStools	10.1111/gcb.14710	Kannenberg, S. A., Novick, K. A., Alexander, M. R., Maxwell, J. T., Moore, D. J. P., Phillips, R. P., & Anderegg, W. R. L. (2019). Linking drought legacy effects across scales: From leaves to tree rings to ecosystems. Global Change Biology. <https://doi.org/10.1111/gcb.14710>	NA	drought legacy effects on ecosystems
plotly	10.1111/2041-210x.13232	Aspillaga, E., Safi, K., Hereu, B., & Bartumeus, F. (2019). Modelling the three‐dimensional space use of aquatic animals combining topography and Eulerian telemetry data. Methods in Ecology and Evolution. <https://doi.org/10.1111/2041-210x.13232>	img/AspillagaEtal2019MethodsInEcology&Evolution.png	modelling 3d space use of aquatic animals
plotly	10.1038/s41598-019-43875-3	Gibson, K. M., Nguyen, B. N., Neumann, L. M., Miller, M., Buss, P., Daniels, S., … Pukazhenthi, B. (2019). Gut microbiome differences between wild and captive black rhinoceros – implications for rhino health. Scientific Reports, 9(1). <https://doi.org/10.1038/s41598-019-43875-3>	NA	gut microbiome health in the black rhinoceros
skimr	10.1007/s11482-019-09730-3	Sinval, J., Sirgy, M. J., Lee, D.-J., & Marôco, J. (2019). The Quality of Work Life Scale: Validity Evidence from Brazil and Portugal. Applied Research in Quality of Life. <https://doi.org/10.1007/s11482-019-09730-3>	NA	the Quality of Work Life Scale (QWLS)
hunspell	NA	Iserman, M., Nalabandian, T., & Ireland, M. (2019, June). Dictionaries and Decision Trees for the 2019 CLPsych Shared Task. In Proceedings of the Sixth Workshop on Computational Linguistics and Clinical Psychology (pp. 188-194). <https://www.aclweb.org/anthology/W19-3025>	NA	dictionares and decision trees
rfishbase	10.1111/jbi.13595	Goodman, M. C., Hannah, S. M., & Ruttenberg, B. I. (2019). The relationship between geographic range extent, sea surface temperature and adult traits in coastal temperate fishes. Journal of Biogeography. <https://doi.org/10.1111/jbi.13595>	img/GoodmanEtal2019JournalOfBiogeography.png	the influence of ocean basin, traits and sea surface temperature on ranges
RSelenium	10.1002/joc.6177	Fioravanti, G., Piervitali, E., & Desiato, F. (2019). A new homogenized daily data set for temperature variability assessment in Italy. International Journal of Climatology. <https://doi.org/10.1002/joc.6177>	NA	a dataset for temperature variability assessment in Italy
magick	10.1016/j.chemosphere.2019.05.246	Logemann, A., Schafberg, M., & Brockmeyer, B. (2019). Using the HPTLC-bioluminescence bacteria assay for the determination of acute toxicities in marine sediments and its eligibility as a monitoring assessment tool. Chemosphere. <https://doi.org/10.1016/j.chemosphere.2019.05.246>	NA	bioluminescence bacteria assays
rentrez	NA	Al-Mustanjid, A. (2019). Design of a common pathway drug for all types of cardiovascular diseases: A network biology approach. Network Biology, 9(2), 28. <http://www.iaees.org/publications/journals/nb/articles/2019-9(2)/design-of-a-common-pathway-drug-for-cardiovascular-diseases.pdf>	NA	cardiovascular diseases
MODIStools	10.1186/s40795-019-0296-5	Wambui, K. M., & Musenge, E. (2019). A space-time analysis of recurrent malnutrition-related hospitalisations in Kilifi, Kenya for children under-5 years. BMC Nutrition, 5(1). <https://doi.org/10.1186/s40795-019-0296-5>	NA	malnutrition in Kilifi, Kenya
plotly	10.1186/s40168-019-0702-x	Wright, R. J., Gibson, M. I., & Christie-Oleza, J. A. (2019). Understanding microbial community dynamics to improve optimal microbiome selection. Microbiome, 7(1). <https://doi.org/10.1186/s40168-019-0702-x>	NA	improving optimal microbiome selection
FedData	10.1111/tbed.13265	Meisner, J., Clifford, W. R., Wohrle, R. D., Kangiser, D., & Rabinowitz, P. (2019). Soil and climactic predictors of canine coccidioidomycosis seroprevalence in Washington State: an ecological cross‐sectional study. Transboundary and Emerging Diseases. <https://doi.org/10.1111/tbed.13265>	NA	soil and climate predictors of a canine infection
rotl	10.1016/j.biocon.2019.05.054	Tetzlaff, S. J., Sperry, J. H., & DeGregorio, B. A. (2019). Effects of antipredator training, environmental enrichment, and soft release on wildlife translocations: A review and meta-analysis. Biological Conservation, 236, 324–331. <https://doi.org/10.1016/j.biocon.2019.05.054>	NA	wildlife translocations
rredlist	10.1111/jbi.13619	Alhajeri, B. H., & Fourcade, Y. (2019). High correlation between species‐level environmental data estimates extracted from IUCN expert range maps and from GBIF occurrence data. Journal of Biogeography. <https://doi.org/10.1111/jbi.13619>	img/Alhajeri&Fourcade2019JournalOfBiogeography.png	species-level environmental data derived from IUCN vs. GBIF
rgbif	10.1111/jbi.13619	Alhajeri, B. H., & Fourcade, Y. (2019). High correlation between species‐level environmental data estimates extracted from IUCN expert range maps and from GBIF occurrence data. Journal of Biogeography. <https://doi.org/10.1111/jbi.13619>	img/Alhajeri&Fourcade2019JournalOfBiogeography.png	species-level environmental data derived from IUCN vs. GBIF
taxize	10.3390/genes10060431	Boggs, Scheible, Machado, & Meiklejohn. (2019). Single Fragment or Bulk Soil DNA Metabarcoding: Which is Better for Characterizing Biological Taxa Found in Surface Soils for Sample Separation? Genes, 10(6), 431. <https://doi.org/10.3390/genes10060431>	NA	comparing single fragment vs. bulk soil DNA metabarcoding
rgbif	10.3897/zookeys.852.28567	Ros-Candeira, A., Pérez-Luque, A. J., Suárez-Muñoz, M., Bonet-García, F. J., Hódar, J. A., Giménez de Azcárate, F., & Ortega-Díaz, E. (2019). Dataset of occurrence and incidence of pine processionary moth in Andalusia, south Spain. ZooKeys, 852, 125–136. <https://doi.org/10.3897/zookeys.852.28567>	img/Ros-CandeiraEtal2019Zookeys.png	an occurrence dataset of the pest pine processionary moth
rfishbase	10.32942/osf.io/8cu4y	Van Denderen, D., Gislason, H., & Andersen, K. H. (2019). Little difference in average fish growth and maximum size across temperatures. EcoEvoRxiv. <https://doi.org/10.32942/osf.io/8cu4y>	img/vanDenderenEtal2019EcoEvoRxiv-Preprint.png	fish size and growth
plotly	10.1111/1365-2656.13041	Bailey, L. D., Ens, B. J., Both, C., Heg, D., Oosterbeek, K., & van de Pol, M. (2019). Habitat selection can reduce effects of extreme climatic events in a long‐lived shorebird. Journal of Animal Ecology. <https://doi.org/10.1111/1365-2656.13041>	img/BaileyEtal2019JournalOfAnimalEcology.png	effects of climatic events on shorebirds
taxize	10.1371/journal.pone.0216723	Palacios-Abrantes, J., Cisneros-Montemayor, A. M., Cisneros-Mata, M. A., Rodríguez, L., Arreguín-Sánchez, F., Aguilar, V., … Cheung, W. W. L. (2019). A metadata approach to evaluate the state of ocean knowledge: Strengths, limitations, and application to Mexico. PLOS ONE, 14(6), e0216723. <https://doi.org/10.1371/journal.pone.0216723>	NA	evaluating ocean knowledge in Mexico
rotl	10.3897/biss.3.36207	McTavish, E. J. (2019). Linking Biodiversity Data Using Evolutionary History. Biodiversity Information Science and Standards, 3. <https://doi.org/10.3897/biss.3.36207>	NA	linking biodiversity data using evolutionary history
rfishbase	10.1016/j.biocon.2019.05.003	Nyboer, E. A., Liang, C., & Chapman, L. J. (2019). Assessing the vulnerability of Africa’s freshwater fishes to climate change: A continent-wide trait-based analysis. Biological Conservation, 236, 505–520. <https://doi.org/10.1016/j.biocon.2019.05.003>	img/NyboerEtal2019BiologicalConservation.png	assessing vulnerability of fishes to climate change
rredlist	10.1016/j.biocon.2019.05.003	Nyboer, E. A., Liang, C., & Chapman, L. J. (2019). Assessing the vulnerability of Africa’s freshwater fishes to climate change: A continent-wide trait-based analysis. Biological Conservation, 236, 505–520. <https://doi.org/10.1016/j.biocon.2019.05.003>	img/NyboerEtal2019BiologicalConservation.png	assessing vulnerability of fishes to climate change
phylotar	10.21105/joss.01350	Krah, F.-S., & Heibl, C. (2019). rGUIDANCE – alignment confidence score computation in R. Journal of Open Source Software, 4(36), 1350. <https://doi.org/10.21105/joss.01350>	NA	alignment confidence score computation in R
osmdata	10.1111/tbed.13267	Morelle, K., Jezek, M., Licoppe, A., & Podgorski, T. (2019). Deathbed choice by ASF‐infected wild boar can help find carcasses. Transboundary and Emerging Diseases. <https://doi.org/10.1111/tbed.13267>	NA	African swine fever in wild boars
rgbif	10.3897/biss.3.36207	McTavish, E. J. (2019). Linking Biodiversity Data Using Evolutionary History. Bio/diversity Information Science and Standards, 3. <https://doi.org/10.3897/biss.3.36207>	NA	linking biodiversity data using evolutionary history
rredlist	10.3897/bdj.7.e36226	Grattarola, F., Botto, G., da Rosa, I., Gobel, N., González, E., González, J., … Pincheira-Donoso, D. (2019). Biodiversidata: An Open-Access Biodiversity Database for Uruguay. Biodiversity Data Journal, 7. <https://doi.org/10.3897/bdj.7.e36226>	img/GrattarolaEtal2019BiodiversityDataJournal.png	a biodiversity database for Uruguay
taxize	10.3897/bdj.7.e36226	Grattarola, F., Botto, G., da Rosa, I., Gobel, N., González, E., González, J., … Pincheira-Donoso, D. (2019). Biodiversidata: An Open-Access Biodiversity Database for Uruguay. Biodiversity Data Journal, 7. <https://doi.org/10.3897/bdj.7.e36226>	img/GrattarolaEtal2019BiodiversityDataJournal.png	a biodiversity database for Uruguay
rotl	10.1016/j.bbapap.2019.06.010	Kravchuk, O. I., Lyupina, Y. V., Erokhov, P. A., Finoshin, A. D., Adameyko, K. I., Mishyna, M. Y., … Mikhailov, V. S. (2019). Characterization of the 20S proteasome of the lepidopteran, Spodoptera frugiperda. Biochimica et Biophysica Acta (BBA) - Proteins and Proteomics. <https://doi.org/10.1016/j.bbapap.2019.06.010>	NA	sequencing a lepidopteran proteasome
stplanr	10.1177/2399808319857726	Yen, Y., Zhao, P., & Sohail, M. T. (2019). The morphology and circuity of walkable, bikeable, and drivable street networks in Phnom Penh, Cambodia. Environment and Planning B: Urban Analytics and City Science, 239980831985772. <https://doi.org/10.1177/2399808319857726>	img/YenEtal2019UrbanAnalytics&CityScience.png	street networks in Phnom Phen, Cambodia
taxize	10.3390/ijms20102397	Danella Figo, D., De Amicis, K., Neiva Santos de Aquino, D., Pomiecinski, F., Gadermaier, G., Briza, P., … Souza Santos, K. (2019). Cashew Tree Pollen: An Unknown Source of IgE-Reactive Molecules. International Journal of Molecular Sciences, 20(10), 2397. <https://doi.org/10.3390/ijms20102397>	NA	cashew tree pollen as an allergen
hydroscoper	NA	Kanterakis, G., Skoulikaris, C., & Dimitriou, E. Assessment of hydrological modelling behaviour at basin scale on the number of delineated sub-basins. Proceedings of the Seventh International Conference on Environmental Management, Engineering, Planning & Economics <https://www.researchgate.net/profile/Charalampos_Skoulikaris/publication/333652500_Assessment_of_hydrological_modelling_behaviour_at_basin_scale_on_the_number_of_delineated_sub-basins/links/5cfa46ba4585157d15991da1/Assessment-of-hydrological-modelling-behaviour-at-basin-scale-on-the-number-of-delineated-sub-basins.pdf>	NA	hydrological modelling
rfishbase	10.1016/j.pocean.2019.102124	Petrik, C. M., Stock, C. A., Andersen, K. H., van Denderen, P. D., & Watson, J. R. (2019). Bottom-up drivers of global patterns of demersal, forage, and pelagic fishes. Progress in Oceanography, 176, 102124. <https://doi.org/10.1016/j.pocean.2019.102124>	img/PetrikEtal2019ProgressInOceanography.png	drivers of global patterns of fishes
tokenizers	NA	Calderone, A. (2019). A Computational Analysis of Natural Languages to Build a Sentence Structure Aware Artificial Neural Network. arXiv preprint arXiv:1906.05491 <https://arxiv.org/pdf/1906.05491.pdf>	img/Calderone2019arXiv.png	sentence structure aware artificial neural network
rgbif	10.7717/peerj.6792	Uzma, Jiménez-Mejías, P., Amir, R., Hayat, M. Q., & Hipp, A. L. (2019). Timing and ecological priority shaped the diversification of sedges in the Himalayas. PeerJ, 7, e6792. <https://doi.org/10.7717/peerj.6792>	img/UzmaEtal2019PeerJ.png	sedge diversification in the Himalayas
rerddap	10.1038/s41598-019-44695-1	Baylis, A. M. M., Tierney, M., Orben, R. A., Warwick-Evans, V., Wakefield, E., Grecian, W. J., … Brickle, P. (2019). Important At-Sea Areas of Colonial Breeding Marine Predators on the Southern Patagonian Shelf. Scientific Reports, 9(1). <https://doi.org/10.1038/s41598-019-44695-1>	img/BaylisEtal2019ScientificReports.png	important colonial breeding areas for marine predators
plotly	10.1016/j.ajpath.2019.05.009	Nourbakhsh, M., Mansoor, A., Koro, K., Zhang, Q., & Minoo, P. (2019). Expression Profiling Reveals Involvement of WNT Pathway in the Malignant Progression of Sessile Serrated Adenomas. The American Journal of Pathology. <https://doi.org/10.1016/j.ajpath.2019.05.009>	NA	colorectal cancer
CoordinateCleaner	10.3897/biss.3.35829	Waller, J. (2019). Data Location Quality at GBIF. Biodiversity Information Science and Standards, 3. <https://doi.org/10.3897/biss.3.35829>	NA	GBIF data quality
rentrez	10.1016/j.gecco.2019.e00689	Shackleton, M. E., Rees, G. N., Watson, G., Campbell, C., & Nielsen, D. (2019). Environmental DNA reveals landscape mosaic of wetland plant communities. Global Ecology and Conservation, 19, e00689. <https://doi.org/10.1016/j.gecco.2019.e00689>	NA	landscape mosaics of wetland plant communities
MODIStsp	10.1177/0962280219856380	Nelli, L., Ferguson, H. M., & Matthiopoulos, J. (2019). Achieving explanatory depth and spatial breadth in infectious disease modelling: Integrating active and passive case surveillance. Statistical Methods in Medical Research, 096228021985638. <https://doi.org/10.1177/0962280219856380>	img/NelliEtal2019StatisticalMethodsInMedicalResearch.png	infectious disease modelling
plotly	10.1093/bioinformatics/btz409	Glicksberg, B. S., Oskotsky, B., Thangaraj, P. M., Giangreco, N., Badgeley, M. A., Johnson, K. W., … Butte, A. J. (2019). PatientExploreR: an extensible application for dynamic visualization of patient clinical history from electronic health records in the OMOP common data model. Bioinformatics. <https://doi.org/10.1093/bioinformatics/btz409>	NA	visualization of patient clinical history
tacmagic	10.1111/jon.12646	Brown, E. E., Rashidi‐Ranjbar, N., Caravaggio, F., Gerretsen, P., Pollock, B. G., … Mulsant, B. H. (2019). Brain Amyloid PET Tracer Delivery is Related to White Matter Integrity in Patients with Mild Cognitive Impairment. Journal of Neuroimaging. <https://doi.org/10.1111/jon.12646>	img/BrownEtal2019JournalOfNeuroimaging.png	Alzheimer's disease
rentrez	10.1016/j.csbj.2019.06.019	Koppelstaetter, C., Leierer, J., Rudnicki, M., Kerschbaum, J., Kronbichler, A., Melk, A., … Perco, P. (2019). Computational Drug Screening Identifies Compounds Targeting Renal Age-associated Molecular Profiles. Computational and Structural Biotechnology Journal, 17, 843–853. <https://doi.org/10.1016/j.csbj.2019.06.019>	NA	compounds targeting renal age-associated molecular profiles
pdftools	10.1007/978-3-030-22646-6_3	Calero Valdez A., Ziefle M. (2019) Trends and Changes in the Field of HCI the Last Decade from the Perspective of HCII Conference. In: Kurosu M. (eds) Human-Computer Interaction. Perspectives on Design. HCII 2019. Lecture Notes in Computer Science, vol 11566. Springer, Cham <https://doi.org/10.1007/978-3-030-22646-6_3>	NA	trends and changes in human computer interaction research
rfishbase	10.1093/icb/icz119	Alfaro, M. E., Karan, E., Schwartz, S. T., & Shultz, A. J. (2019). The Evolution of Color Pattern in Butterflyfishes (Chaetodontidae). Integrative and Comparative Biology. <https://doi.org/10.1093/icb/icz119>	img/AlfaroEtal2019Integrative&ComparativeBiology.png	color pattern in Butterflyfishes
rgbif	10.1002/ecy.2817	Butterfield, B. J., Holmgren, C. A., Anderson, R. S., & Betancourt, J. L. (2019). Life history traits predict colonization and extinction lags of desert plant species since the Last Glacial Maximum. Ecology. <https://doi.org/10.1002/ecy.2817>	NA	colonization and extinction lags of desert plant species
CoordinateCleaner	10.1002/ecy.2817	Butterfield, B. J., Holmgren, C. A., Anderson, R. S., & Betancourt, J. L. (2019). Life history traits predict colonization and extinction lags of desert plant species since the Last Glacial Maximum. Ecology. <https://doi.org/10.1002/ecy.2817>	NA	colonization and extinction lags of desert plant species
rfishbase	10.1086/704713	Kovalenko, K. E., Johnson, L. B., Brady, V. J., Ciborowski, J. J. H., Cooper, M. J., Gathman, J. P., … Uzarski, D. G. (2019). Hotspots and bright spots in functional and taxonomic fish diversity. Freshwater Science, 000–000. <https://doi.org/10.1086/704713>	img/KovalenkoEtal2019FreshwaterScience.png	functional and taxonomic fish diversity
rentrez	10.1038/s41598-019-45857-x	Ferraz, M. de A. M. M., Carothers, A., Dahal, R., Noonan, M. J., & Songsasen, N. (2019). Oviductal extracellular vesicles interact with the spermatozoon’s head and mid-piece and improves its motility and fertilizing ability in the domestic cat. Scientific Reports, 9(1). <https://doi.org/10.1038/s41598-019-45857-x>	NA	influence of oviductal extracellular vesicles on sperm function in domestic cats
tesseract	10.1109/compsac.2019.10184	Saxena, P., Saxena, D., Nie, X., Helmers, A., Ramachandran, N., Sakib, N., & Ahamed, S. (2019). Feature Boosting in Natural Image Classification. 2019 IEEE 43rd Annual Computer Software and Applications Conference (COMPSAC). <https://doi.org/10.1109/compsac.2019.10184>	img/SaxenaEtal2019IEEEConferencePaper.png	natural image classification
MODIStsp	10.1007/978-3-030-24302-9_51	Pilogallo, A., Saganeiti, L., Scorza, F., & Murgante, B. (2019). Investigating Urban Growth Dynamic – Land Surface Temperature Relationship. Lecture Notes in Computer Science, 701–710. <https://doi.org/10.1007/978-3-030-24302-9_51>	NA	urban growth dynamics
neotoma	NA	Sang, Zihaohan. No-analog ecological communities since the last glacial maximum inferred from fossil pollen records for North America. Diss. University of Alberta, 2019. <https://sites.ualberta.ca/~ahamann/people/pdfs/Sang_2019_MSc.pdf>	img/Sang2019MScThesis.png	no-analog ecological communities
plotly	10.3390/cells8070675	Xia, Liu, Zhang, & Guo. (2019). GEDS: A Gene Expression Display Server for mRNAs, miRNAs and Proteins. Cells, 8(7), 675. <https://doi.org/10.3390/cells8070675>	NA	gene expression web application
plotly	NA	Burkett, Kaitlyn E. Who Is Ready To Retire: Your Average Life Expectancy And The Savings Needed To Support You. Diss. Appalachian State University, 2019. <https://libres.uncg.edu/ir/asu/f/Burkett_Kaitlyn_2019_Thesis.pdf>	NA	retirement savings
rfishbase	10.20944/preprints201907.0030.v1	Valdez, J. W., & Mandrekar, K. (2019). Assessing the Species in the CARES Preservation Program and the Role of Aquarium Hobbyists in Freshwater Fish Conservation. <https://doi.org/10.20944/preprints201907.0030.v1>	NA	role of aquarium hobbyists in freshwater fish conservation
rgbif	10.1016/j.ecolind.2019.105539	Correia, R. A., Ruete, A., Stropp, J., Malhado, A. C. M., dos Santos, J. W., Lessa, T., … Ladle, R. J. (2019). Using ignorance scores to explore biodiversity recording effort for multiple taxa in the Caatinga. Ecological Indicators, 106, 105539. <https://doi.org/10.1016/j.ecolind.2019.105539>	img/CorreiaEtal2019EcologicalIndicators.png	ignorance scores to measure recording effort
hunspell	10.2196/14499	Lin, C., Lou, Y.-S., Tsai, D.-J., Lee, C.-C., Hsu, C.-J., Wu, D.-C., … Fang, W.-H. (2019). Projection Word Embedding Model With Hybrid Sampling Training for Classifying ICD-10-CM Codes: Longitudinal Observational Study. JMIR Medical Informatics, 7(3), e14499. <https://doi.org/10.2196/14499>	NA	word embeddings for electronic health records
RNeXML	10.1186/s12859-019-2982-3	Stöver, B. C., Wiechers, S., & Müller, K. F. (2019). JPhyloIO: a Java library for event-based reading and writing of different phylogenetic file formats through a common interface. BMC Bioinformatics, 20(1). <https://doi.org/10.1186/s12859-019-2982-3>	NA	Java library for reading/writing phylogenetic file formats
spocc	10.1111/mec.15182	Myers, E. A., Xue, A. T., Gehara, M., Cox, C., Davis Rabosky, A. R., Lemos‐Espinal, J., … Burbrink, F. T. (2019). Environmental Heterogeneity and Not Vicariant Biogeographic Barriers Generate Community Wide Population Structure in Desert Adapted Snakes. Molecular Ecology. <https://doi.org/10.1111/mec.15182>	img/MyersEtal2019MolecularEcology.png	community structure in desert snakes
fingertipsR	NA	Van Schaik, P., Peng, Y., Ojelabi, A., & Ling, J. (2019). Explainable statistical learning in public health for policy development: the case of real-world suicide data. BMC medical research methodology, 19(1), 152. <https://bmcmedresmethodol.biomedcentral.com/articles/10.1186/s12874-019-0796-7>	NA	open data, statistics, and public health
taxize	10.1111/jbi.13653	Hagen, O., Vaterlaus, L., Albouy, C., Brown, A., Leugger, F., Onstein, R. E., … Pellissier, L. (2019). Mountain building, climate cooling and the richness of cold‐adapted plants in the Northern Hemisphere. Journal of Biogeography. <https://doi.org/10.1111/jbi.13653>	img/HagenEtal2019JounalOfBiogeography.png	the origins of cold-adapted plant species diversity
